{
  "format": "wl3pc.room",
  "format_version": 1,
  "id": "testbed",
  "tile_size_px": 16,
  "legend": {".": "empty", "#": "solid", "=": "platform"},
  "rows": [
    "########################",
    "#......................#",
    "#......................#",
    "#......................#",
    "#..............====....#",
    "#......................#",
    "#.........###..........#",
    "#.....==...............#",
    "#..................##..#",
    "#.........#........##..#",
    "#......................#",
    "########################"
  ]
}
